{
  "version": 1,
  "generated_at": "2026-09-17T05:01:28Z",
  "domains": [
    {
      "domain_id": "ES",
      "gazette_id": "boe",
      "gazette_name": "Boletín Oficial del Estado",
      "domain_status": "PROVEN",
      "surfaces": [
        {
          "surface_id": "boe-sumario-api",
          "kind": "api",
          "url": "https://www.boe.es/datosabiertos/api/boe/sumario/{AAAAMMDD}",
          "notes": "requires Accept: application/json; 400 on plain GET"
        },
        {
          "surface_id": "boe-consolidada-api",
          "kind": "api",
          "url": "https://www.boe.es/datosabiertos/api/legislacion-consolidada"
        },
        {
          "surface_id": "boe-doc",
          "kind": "document",
          "url": "https://www.boe.es/buscar/doc.php?id=BOE-A-YYYY-NNNNN"
        },
        {
          "surface_id": "boe-eli-resolver",
          "kind": "portal",
          "url": "https://www.boe.es/eli/es/..."
        }
      ],
      "discovery_mechanism": "sumario_api + consolidated_api",
      "fetch_mechanism": "get_simple",
      "doc_id_scheme": "BOE-A-YYYY-NNNNN + ELI",
      "formats": [
        "json",
        "xml",
        "html",
        "pdf"
      ],
      "parser_family": "NEW:boe_consolidada_xml",
      "version_signal": "consolidated_api",
      "change_detection": {
        "mechanism": "sumario API daily + legislacion-consolidada fecha_actualizacion from/to",
        "strength": "strong",
        "cadence": "daily"
      },
      "reachability_expected": {
        "es_local": "REACHABLE",
        "foreign_ci": "REACHABLE"
      },
      "fallback": "boe.es web UI (buscar/doc.php)",
      "license": {
        "terms": "reutilización información pública (datos abiertos BOE)",
        "url": "https://www.boe.es/datosabiertos/"
      },
      "candidate_profile": "pipeline/sources/atlas/boe.profile.json",
      "status_evidence": "sumario API + doc.php probed live es_local 2026-09-18 (200 JSON/XML, evidence preserved). G0 verified consolidated corpus; caveat: CCAA PRUG decrees are NOT in the consolidated corpus — BOE suffices for state framework laws only.",
      "notes": "Accept header mandatory on datosabiertos API. Consolidated-corpus absence proves nothing about autonomous gazettes.",
      "probes": [
        {
          "probe_id": "sumario-api",
          "surface_id": "boe-sumario-api",
          "kind": "api",
          "url": "https://www.boe.es/datosabiertos/api/boe/sumario/20260916",
          "observed_at": "2026-09-17T04:39:16Z",
          "runner_network": "es_local",
          "reachability_observed": "REACHABLE",
          "fetch_outcome": "SUCCESS",
          "http_status": 200,
          "content_marker_ok": true,
          "raw_sha256": "6188adbc0b5d4798e1d9dc31ef76c41785fb9df56d0c163b88691eedd1fe9eec",
          "bytes": 232924,
          "content_type": "application/json",
          "evidence_path": "discovery/evidence/m10.2-atlas/es/sumario-api.body",
          "detail": ""
        },
        {
          "probe_id": "doc",
          "surface_id": "boe-doc",
          "kind": "document",
          "url": "https://www.boe.es/buscar/doc.php?id=BOE-A-2007-21952",
          "observed_at": "2026-09-17T04:39:16Z",
          "runner_network": "es_local",
          "reachability_observed": "REACHABLE",
          "fetch_outcome": "SUCCESS",
          "http_status": 200,
          "content_marker_ok": null,
          "raw_sha256": "e76b21f04d450c0f64035991bee0243998a8c401ee7816c61f7b493d5d58f741",
          "bytes": 43460,
          "content_type": "text/html; charset=UTF-8",
          "evidence_path": "discovery/evidence/m10.2-atlas/es/doc.body",
          "detail": ""
        }
      ],
      "evidence_dir": "discovery/evidence/m10.2-atlas/es/"
    },
    {
      "domain_id": "ES-AN",
      "gazette_id": "boja",
      "gazette_name": "Boletín Oficial de la Junta de Andalucía",
      "domain_status": "PROVEN",
      "surfaces": [
        {
          "surface_id": "boja-portal",
          "kind": "portal",
          "url": "https://www.juntadeandalucia.es/boja"
        },
        {
          "surface_id": "boja-doc-url",
          "kind": "document",
          "url": "https://www.juntadeandalucia.es/boja/{YYYY}/{issue}/{doc}"
        },
        {
          "surface_id": "sedeboja-consolidados",
          "kind": "portal",
          "url": "https://www.juntadeandalucia.es/sedeboja",
          "notes": "consolidated-texts portal; no clean API verified"
        }
      ],
      "discovery_mechanism": "issue_index_html (sumario per /boja/{YYYY}/{issue})",
      "fetch_mechanism": "get_simple",
      "doc_id_scheme": "(YYYY, issue, doc) URL triple; print id BOJA-b-YYYY-NNNNN",
      "formats": [
        "html",
        "pdf"
      ],
      "parser_family": "NEW:boja_html",
      "version_signal": "none_verified",
      "change_detection": {
        "mechanism": "issue index polling",
        "strength": "medium",
        "cadence": "daily"
      },
      "reachability_expected": {
        "es_local": "REACHABLE",
        "foreign_ci": "REACHABLE"
      },
      "fallback": "BOE consolidada for the consolidated subset",
      "license": {
        "terms": "not_verified",
        "url": "https://www.juntadeandalucia.es/avisolegal"
      },
      "candidate_profile": null,
      "status_evidence": "portal + document probed live es_local 2026-09-18 (doc /boja/2011/155/41 → 200, 136216B stored; portal 200). G0 probe boja-doc re-confirmed.",
      "notes": "HEAD requests time out — GET only. Consolidated portal exists but no API verified.",
      "probes": [
        {
          "probe_id": "doc",
          "surface_id": "boja-doc-url",
          "kind": "document",
          "url": "https://www.juntadeandalucia.es/boja/2011/155/41",
          "observed_at": "2026-09-17T04:38:11Z",
          "runner_network": "es_local",
          "reachability_observed": "REACHABLE",
          "fetch_outcome": "SUCCESS",
          "http_status": 200,
          "content_marker_ok": null,
          "raw_sha256": "c86f05dd8b4801b392d86f8333b6da80b2bd455cf11b4d9a5943ed2253f715e3",
          "bytes": 136216,
          "content_type": "text/html; charset=UTF-8",
          "evidence_path": "discovery/evidence/m10.2-atlas/es-an/doc.body",
          "detail": ""
        },
        {
          "probe_id": "portal",
          "surface_id": "boja-portal",
          "kind": "portal",
          "url": "https://www.juntadeandalucia.es/boja",
          "observed_at": "2026-09-17T04:40:48Z",
          "runner_network": "es_local",
          "reachability_observed": "REACHABLE",
          "fetch_outcome": "SUCCESS",
          "http_status": 200,
          "content_marker_ok": null,
          "raw_sha256": "32dd4f24a32ce35310e2a1cafc7a41ca0a139a997a1720a30d6a2be7fa5885a7",
          "bytes": 133515,
          "content_type": "text/html; charset=UTF-8",
          "evidence_path": "discovery/evidence/m10.2-atlas/es-an/portal.body",
          "detail": ""
        }
      ],
      "evidence_dir": "discovery/evidence/m10.2-atlas/es-an/"
    },
    {
      "domain_id": "ES-AR",
      "gazette_id": "boa",
      "gazette_name": "Boletín Oficial de Aragón",
      "domain_status": "PROVEN",
      "surfaces": [
        {
          "surface_id": "boa-cgi-verdoc",
          "kind": "document",
          "url": "https://www.boa.aragon.es/cgi-bin/EBOA/BRSCGI?BASE=BOLE&CMD=VERDOC&DOCN={docn}&SEC=BUSQUEDA_AVANZADA&SEPARADOR="
        },
        {
          "surface_id": "boa-cgi-search",
          "kind": "portal",
          "url": "https://www.boa.aragon.es/cgi-bin/EBOA/BRSCGI"
        }
      ],
      "discovery_mechanism": "legacy_cgi (BRSCGI VERDOC by DOCN)",
      "fetch_mechanism": "cgi",
      "doc_id_scheme": "DOCN (internal numeric, e.g. 007922169)",
      "formats": [
        "html",
        "pdf"
      ],
      "parser_family": "boa_html",
      "version_signal": "gazette_publication",
      "change_detection": {
        "mechanism": "cgi bulletin polling",
        "strength": "weak",
        "cadence": "daily"
      },
      "reachability_expected": {
        "es_local": "REACHABLE",
        "foreign_ci": "REACHABLE"
      },
      "fallback": null,
      "license": {
        "terms": "not_verified",
        "url": ""
      },
      "candidate_profile": "pipeline/sources/boa.profile.json",
      "status_evidence": "M10.1 pilot P2 chain PASS + fresh doc probe es_local 2026-09-18 (25274B — identical byte count to live verify 2026-09-16). ISO-8859-1 encoding.",
      "notes": "Consolidated-legislation portal exists; API not verified.",
      "probes": [
        {
          "probe_id": "doc",
          "surface_id": "boa-doc",
          "kind": "document",
          "url": "https://www.boa.aragon.es/cgi-bin/EBOA/BRSCGI?BASE=BOLE&CMD=VERDOC&DOCN=007922169&SEC=BUSQUEDA_AVANZADA&SEPARADOR=",
          "observed_at": "2026-09-17T04:43:06Z",
          "runner_network": "es_local",
          "reachability_observed": "REACHABLE",
          "fetch_outcome": "SUCCESS",
          "http_status": 200,
          "content_marker_ok": null,
          "raw_sha256": "3c560f0a44447d7d3f8054855efd9e680fad6c5354bed7f7bc0e8b7a35a16ef1",
          "bytes": 25274,
          "content_type": "text/html; charset=ISO-8859-1",
          "evidence_path": "discovery/evidence/m10.2-atlas/es-ar/doc.body",
          "detail": ""
        }
      ],
      "evidence_dir": "discovery/evidence/m10.2-atlas/es-ar/"
    },
    {
      "domain_id": "ES-AS",
      "gazette_id": "bopa",
      "gazette_name": "Boletín Oficial del Principado de Asturias",
      "domain_status": "PROVEN",
      "surfaces": [
        {
          "surface_id": "bopa-portal",
          "kind": "portal",